{
  "contractVersion": "multi-agent/v1",
  "requestId": "ma-req-review",
  "agentRunId": "run-review",
  "organizationId": "org-1",
  "userId": "user-1",
  "mode": "PROJECT",
  "projectId": "project-1",
  "taskId": "task-root",
  "taskPlanId": "plan-1",
  "conversationId": "conversation-1",
  "agentRefs": [{ "agentId": "agent-reviewer", "runConfigurationSnapshotId": null, "role": "reviewer" }],
  "modelPoolRef": "pool-1",
  "context": {
    "contextPackageId": "context-review",
    "tokenBudget": 4096,
    "sources": [
      { "type": "ARTIFACT", "sourceId": "artifact-patch", "content": "patch", "priority": 100 },
      { "type": "ARTIFACT", "sourceId": "artifact-commit", "content": "commit proposal", "priority": 90 }
    ]
  },
  "capabilities": { "allowedToolNames": [], "allowedSkillIds": [], "allowedMcpServerIds": [] },
  "cursor": { "phase": "review", "checkpointId": "checkpoint-review", "planStepId": "step-1", "childTaskId": "task-child-1" },
  "limits": { "maxDelegations": 8, "maxParallelAgents": 2, "maxDepth": 4, "remainingTokenBudget": 3000 }
}
