{
  "contractVersion": "multi-agent/v1",
  "requestId": "ma-req-provider",
  "agentRunId": "run-provider",
  "organizationId": "org-1",
  "userId": "user-1",
  "mode": "PROJECT",
  "projectId": "project-1",
  "taskId": "task-root",
  "taskPlanId": null,
  "conversationId": "conversation-1",
  "agentRefs": [
    { "agentId": "agent-1", "runConfigurationSnapshotId": "run-provider", "role": "supervisor" }
  ],
  "modelPoolRef": "pool-1",
  "context": {
    "contextPackageId": "context-provider",
    "tokenBudget": 8192,
    "sources": [
      { "type": "TASK", "sourceId": "task-root", "content": "Plan the durable task", "priority": 100 }
    ]
  },
  "capabilities": {
    "allowedToolNames": [],
    "allowedSkillIds": [],
    "allowedMcpServerIds": []
  },
  "cursor": {
    "phase": "planning",
    "checkpointId": "checkpoint-provider",
    "planStepId": null,
    "childTaskId": null
  },
  "limits": {
    "maxDelegations": 8,
    "maxParallelAgents": 2,
    "maxDepth": 4,
    "remainingTokenBudget": 3000
  },
  "reasoning": {
    "mode": "PROVIDER",
    "round": 0,
    "logicalCallId": "multi-agent:supervisor:r7",
    "result": null
  }
}
