{
  "contractVersion": "multi-agent/v1",
  "requestId": "ma-req-complete",
  "agentRunId": "run-complete",
  "organizationId": "org-1",
  "userId": "user-1",
  "mode": "CHAT",
  "projectId": null,
  "taskId": null,
  "taskPlanId": null,
  "conversationId": "conversation-4",
  "agentRefs": [],
  "modelPoolRef": null,
  "context": { "contextPackageId": "context-4", "tokenBudget": 1024, "sources": [] },
  "capabilities": { "allowedToolNames": [], "allowedSkillIds": [], "allowedMcpServerIds": [] },
  "cursor": { "phase": "complete", "checkpointId": "checkpoint-4", "planStepId": null, "childTaskId": null },
  "limits": { "maxDelegations": 0, "maxParallelAgents": 1, "maxDepth": 1, "remainingTokenBudget": 500 }
}
